{
  "schemaVersion": 1,
  "diagnosticId": "deal-task-001-before_execution-none",
  "taskId": "deal-task-001",
  "planId": "deal-task-001-plan",
  "planVersion": 1,
  "phase": "before_execution",
  "rootCauseCode": "none",
  "action": "continue",
  "retryable": false,
  "evidenceRefs": [],
  "affectedStepIds": [],
  "collaborationOrganizationId": "",
  "createdAt": "2026-07-29T00:00:00.000Z"
}
